Participant number,Topic,internal condition code,news excerpt
134,Science,FUI,"Scientists have developed 'Platinum', a large tablet specifically designed for older adults above 70 to communicate with one another. Like dating or 'friend' apps used by younger people, this device uses the proprietary app 'Zelon', which allows elderly to connect with other users in the nearby vicinity, including people they do not know. The device is custom made for seniors, with larger, easier to read icons and buttons. 
 
 Older users have been enthusiastic: ""I'm bored at home a lot of the time, but if I look in my app and there's another Zelon user nearby, I know I can reach out to them just for a coffee or a chat,"" beamed Esther, a 90-year-old woman. Aside from Zelon, the tablet includes an e-book reader with large fonts as the default and a read-aloud option that uses the latest in AI voice technology. ""I'm very proud of Platinum,"" said Jonathan Dias, its creator. ""There are so many lonely elderly out there, and they needn't be. I really wanted to help solve that problem."""
135,Science,FUI,"Fishbone is generally the waste produced after consuming fish. It is normally discarded and incinerated to ash before being sent to landfill. This caused the landfill to accumulate faster than expected. Hence, there was extensive research led by a group of scientists from the Korea Marine Academy. Their recent scientific discovery regarding the use of fish bones to make useful products such as paper made the headlines in the academic industry in South Korea. The fishbone was first cleaned thoroughly to remove any excess meat. Once cleaned, it will be sent for drying under 100 degrees Celsius to ensure that no moisture is left. After drying, it will be crushed into powder before the next processing, where high pressure will be used to mold the powder into useful products."
136,Science,FUI,"Researchers at the University of Aalto, Finland have recently developed a new technique for preparing potato harvests. The Finns as is widely known absolutely adore potatoes. To them, it is not only a food but also a valuable base for vodka. These researchers however are taking it a step further, and have found a way to make a creamy souffle dessert of their local genome of potatoes. The scientists proceeded through a 5 year trial period, selectively planting and cultivating strands of potatoes with particularly low density and light texture. ""We were inspired by the Japanese kasutera cakes,"" says Janu Krissen, the project lead, and with the course of many different prototypes, have found it. Restaurants in Finland are considering offering it as part of the lunch set. Little did they know, they had struck gold beneath their feet."
117,Science,RER,"Cryptocurrencies have been on the rise in Singapore. With the emergence of many platforms such as Coinbase or crypto.com, Singaporeans are introduced to a different way of trading like never before. Cryptocurrencies offer a decentralised platform for consumers to trade, so it is a pity the government is quick to clamp down on these platforms."
124,Science,RER,"ChatGPT is making the rounds as a disruptive technology that could potentially change the outlook of the job landscape. As a chatbot with seemingly infinite capabilities, ChatGPT is able to respond to inquiries, provide recommendations, write codes, and solve difficult mathematical problems, all in the blink of an eye. With such a powerful use case, fear among jobseekers has reached another all-time high, as some have claimed that such a technology would replace writers and take away creative agencies."
131,Science,RER,"A group of researchers from Singapore have come out with a device that could detect Covid-19 using our saliva. From the start of Covid-19, the team worked endlessly to develop a work that could detect Covid-19, allowing patients to monitor their conditions and self-isolate immediately. Apart from this test kit, there exists other nasal test kits which use a swab sample from our nose. This has proven uncomfortable for some people, especially young children and the elderly. With this new test kit, people would just have to obtain a sample of their saliva - a process which is far more comfortable than the nasal test kit."
137,Science,RER,The creation of the healthy 365 application. This app serves to motivate Singaporeans to lead a healthy lifestyle. The reward-based system enables one to willingly put in more time exercising as they can exchange their points for vouchers. this app is crucial even more so within the ageing population.
147,Science,RER,"In Singapore, a team of experienced engineers built the infamous MRT. They designed the route using a very new method. They designed it to be convenient for citizens of Singapore. Singapore citizens can now go anywhere they want in Singapore without a car. The entire design of the MRT took them quite a long time or research."
152,Science,RER,"The government has been actively encouraging Singaporeans to switch to an Electric Vehicle as part of the Green Plan 2040. With this in mind, condominiums and commercial areas in Singapore have been granted grants to install EV chargers in carparks. This makes charging the EV more convenient, and it incentivises consumers to make the switch. Evidently, due to this policy, there has been a significant 25% increase in the purchase of EV cars due to this technological development."
101,Science,REI,"Clone and gene alteration have captured the spotlight of mass media ever since the successful cloning of Dolly the sheep. And science has progressed in leaps and bounds ever since that achievement. However, collectively we have all stopped at the line of human experimentation. This self-imposed embargo has recently been smashed by a scientist in China who has reported gene altering human babies. The scientist showed the results in a conference and has raised international concerns and condemnation. The goal in the experiment was to correct a genetic anomaly in the baby to let the baby have a better life, however, side effects may happen. This is after all an experiment. An experiment with a human life."
121,Science,REI,"The science of cloning has long been a debatable topic since its invention. The controversy surrounding this development is understandable. While there can be benefits arising from this scientific development, the risks that come with it must not be neglected. Thus far, many countries have strict regulations pertaining to the use of cloning technology and this is unlikely to change in the near future. 
 
 Cloning of animals is currently allowed and practiced in some countries such as China. Mr Ho, an avid dog lover, has recently cloned one of his dogs which passed away during a traffic accident. He had used the skin cells collected earlier and passed it to Xi'An Hospital for storage till future use. When the need arose recently, he approached the hospital to retrieve the frozen skin cells and begin the cloning process. While he was aware that his action would not be well-received by many, he shared that the sight of his cloned dog was well worth any criticisms he may receive."
126,Science,REI,"Scientists have been trying to find the solution to longer life expectancy in people. Some examples include coming up with an elixir for humans to consume, to changing the DNA in humans by replacing the genes that cause shorter life expectancy in the laboratory. This is so that babies with their genes modified will be able to live longer and experience lower risks of diseases that shorten their lifespan. Such a process is being carried out in countries such as the United States. If successful after completion of clinical trials, this process may be rolled out to interested members of the public. However, people have argued against potential side effects that can occur through unconventional practices. Some have even called it ""an unnatural act against nature"" or ""playing God"". While it has not been official as more studies are required, it seems that perhaps, the future towards living longer is possible."
130,Science,REI,"The rise of artificial intelligence (AI) questions the reality we are in today. Will AI be able to aid us in our daily tasks, or is it there to overpower us and take over us someday? Take ChatGPT for example, while essentially learning how to interact with real-world questions one step at a time, will it be so powerful that one day it can create questions and answer them by itself? AI becoming sentient is a cause for concern as many of these algorithms are still new and are not regulated by certain rules and restrictions. This means that the companies who created them are not bound by any ethical concerns and they can do what is best for their interest, with the intention to profit from these AIs. AI also poses another concern, which is the nature of the originality and creativity of the work they produce. Take for example DALL-E, an AI that can generate artworks based on the prompts inputted by the user. These AI take resources from all over the net and come out with an artwork that might be original, but the way it is created was due to the fact that it has taken inspiration and techniques from many artworks. This means that while it does not copy wholesale from one artwork, it takes ideas from many artworks which it referenced to create something new. These artworks which the AI took reference from were not credited to the artist and it sparked a movement by creative artists to push for copyrights and crediting their work when it comes to taking ideas from their work."
132,Science,REI,"The medical community rejoices at the first successful trial test of the ANC pill. The pill, which has been undergoing decades of research and innovation, is developed to fight the multiplication of cancer cells within the body. After long periods of controlled trial testing, research findings show that with the ANC, cancer patients have an 95% chance of full recovery and no longer have to worry about the odds of remission. Doctors and nurses from St. Jon's Hospital hosted a celebratory event today upon receiving the news, and have started scheduling potential patients to undergo the next phase of trial tests. ""It brings hope... not just for the patients and their family... but also for us doctors who have witnessed how much cancer takes away from one,"" says Dr Luke Moy. Grace Soh, mother of two who suffers from bone cancer, sheds tears of joy when interviewed: ""I just hope that this all works out, so I get to live my life with my girls again."" For many individuals, this miracle pill will change their lives for the better. The ANC pill is still underlying the secondary stages of trial testing but continues to show very promising results. Medical spokespersons have also begun arrangements with local polyclinics to discuss the allocation and pricing of the ANC pill when it is released into the market in the near future."
141,Science,REI,It is now possible to turn stem cells into sperm or eggs. This means that same-sex couples may be able to have biological children in the future. Single parents may also be able to use this method to have children. This is good news for non-traditional families.
146,Science,REI,"AI technology has had yet another breakthrough, with the introduction of chatGPT 4, the AI language module is now able to mimic human writing and speech formation with shock realism. 
 
 Experts have expressed concern that the rapid development of AI, might lead to the downfall of human society. The founder of the world-leading search engine - Google, has recently stepped up to voice his concern about the AI module going out of control. During the interview, he said,"" The unchecked development of AI, is a threat to human society.""
 
 In recent years, companies have made use of AI to replace a magnitude of jobs, such as teleoperators, customer service agents, and factory packers. The workforce has expressed a common fear that AI will replace the manual labour job, thus causing a collapse in the labour market."
151,Science,REI,Commuters on the Circle Line MRT are advised to leave several minutes earlier for work for the next few weeks between Dhoby Ghaut and Promenade stations as well as Marina Bay and Stadium stations. This is due to a fault which was discovered in the tracks during a routine inspection. Free and regular bus services will be offered between the affected regions. Regular announcements updating on the current wait times will be made in-train and across stations for those who still wish to use the circle line during the repairs. A spokesman advises the community to refrain from concern and expresses the gratitude of all workers for their patience. Regular service will be up and running as soon as possible.
106,Science,REI,A new pill was developed by the scientists after spending years of experiments and trials on obese people. The pill is able to control the weight of a person effectively over a period of 3 months. The person does not need to fast or exercise vigorously to reduce their weight. The pill has fat-burning effects and will also control the weight of the person.
110,Science,REI,"Researchers at Nanyang Technological University have recently found a use for the seeds of the Durian fruit. The tropical fruit is a local delicacy and is famous for its pungent smell and green spiky exterior. However, some researchers have found another use for the fruit. The discovery was made in the laboratory early in 2022. Scientists were exploring the potential of using durian seeds and succeeded with their experiments. Local lovers of the fruit should pay attention to their findings as durian prices may be affected. People have previously only known the fruit for its consumption value, but once scientific value joins the foray, prices may rise even higher."
128,Science,REI,"Aligned with the global rise in autonomous vehicles (AVs), Singapore has since welcomed the arrival of AVs on selected routes. Prior to the full launch of AVs on roads, test runs will be conducted during off peak hours to test the feasibility and accuracy of AVs. When interviewed, members of the public have largely expressed support for the rollout of AVs, although others have voiced concerns over potential safety issues. The Land Transport Authority has expressed its commitment to ensuring the safe, viable, and effective rollout of AVs, thereby assuring the public that AVs are carefully managed on our little red dot. To date, approximately 100 tests have been conducted on our roads, with no safety issues arising from these tests. More tests will be conducted over the next 1 year before AVs are slowly rolled out to our main roads, starting with selected neighborhoods in Singapore."
134,Science,REI,"The use of hydroponics to grow vegetables locally has been touted as a means to ensure food security in the future. Given Singapore's limited land mass, local food production has long been a concern for the island state. As always, Singapore has turned to technology for possible solutions. In hydroponic agricultural production, vegetables are grown in a highly controlled environment, with adequate nutrients and light. One advantage of this is that there is no soil contamination or fear of pests or other bacteria. This simplifies the process of cleaning the produce and packaging them for the market. Moreover, the vegetables can be grown on racks in several layers, greatly reducing the amount of land needed for agricultural production. Hydroponics technology, along with high-rise edible gardens set throughout the city, are set to help the country achieve its goal of having 30% of its food produced locally in the future."
137,Science,REI,A recent technological development would be the trace together tokens that were used during 2020-2022 during the Covid period. The trace together tokens were created to track the whereabouts of a person and their close contacts whenever they were out. The presence of these tokens also enables the user to know whether they were in the presence of an infected person. Hence they would be able to take the necessary precautions to ensure they themselves are not a spreader.
138,Science,REI,"Chat GPT has been impacting and changing the lives of many around the world, and Singapore is not left out. Many university students are now using Chat GPT to do their assignments and research papers as this AI is able to consolidate points and research that would otherwise have taken the students days to find out. Schools like NTU and NUS have implemented new policies on top of their usual citations that students have to cite the use of Chat GPT in their work and to provide a paper trail for their usage of it. While such a technology has made life so much easier for a student, its long-term effects on the growth of a young mind remain a question as this is a relatively new technology. Lecturers have mentioned that students should still attempt to rely less on this technology and to produce more original ideas. Yet students are still seen actively using this software as the workload in university has proven to be too much for such young minds."
139,Science,REI,"As technology advances, so do our food preferences too. Just this year, Singapore became the industry leader for alternative foods due to the growing presence of alternative food organizations setting up factories and headquarters here on our sunny island.
 
 What are alternative foods, though? Alternative foods are foods that are cultured from the cells of animals in effort to create foods that are sustainably produced and done so ethically.
 
 Last year, a campaign by Impossible Foods in conjunction with the Singapore Tourism Board promoted local foods and to also promote alternative foods. The partnership of local hawkers and their endorsement of alternative foods has garnered support for alternative foods, helping it to gain traction among consumers here. 
 
 As we begin to see alternative foods develop quickly, what else can we expect to see? Watch this space as we bring the latest news on alternative foods to you."
151,Science,REI,"Beginning for users in the United States, Reddit has announced that they will be paying contributors for top posts. Historically, posts are awarded 'gold' status by the subreddit's peers when they become particularly popular and well-liked. According to the new announcement, the revenue from 'gold' posts typically ranges from $1.99 to $49, and will be split between the website and the original poster. While most responses appear to be excited about the announcement, some remain unsure as it brings up many issues within the reddit community, which already has a significant issue with bots and bias. Yet, many hope to become full-time Redditors."
102,Science,RUI,"Chatbot Chatty is being trialed in a senior daycare centre. She is brought with the intention to make the space more interactive and novel. Chatty is friendly and eager to do her rounds in the centre. 
 Chatty has just started work and the seniors who interacted with her found her to be a patient and kind friend. Chatty is able to accompany seniors out for walks in the garden and will respond when spoken to. She is able to give suggestions on what age-appropriate activities for seniors to do to occupy their time. 
 Chatty is able to play ambient music when seniors are in the centre. She can turn into zen-mode and facilitate meditation sessions."
111,Science,RUI,"The rapid development of vaccines against COVID-19 has been nothing short of remarkable and has been achieved with record pace. Without the pressure of a pandemic, vaccines usually take years, or even decades, to undergo trials and to finally be approved for use. However, this time, the COVID-19 vaccine could have been trialed on a large scale and approved in record time due to the immense funding provided globally to grant and fund the research and development of this vaccine. In addition, the multiple grants provided to many different companies created intense competition for companies such as Pfizer and Moderna to develop their vaccines in record speed, in order to be competitive on the global market. Although the vaccines have been developed and approved in such a short span of time, medical experts worldwide assure everyone that the vaccines are generally safe and have been extensively studied to the point where there is little risk in getting vaccinated. It is truly remarkable how in 2023, a large percentage of the world's population has been vaccinated, which has enabled life around the world to resume to normal and made mass travel possible. This is something no one could have ever dreamed of in the height of the pandemic in 2020. Looking at the current state of the world right now, where economic growth has been achieved by many countries, it is hard to imagine a reality where vaccines have not been made available to the public, which would have been the case without the urgency brought about by the massive loss of lives and livelihoods during the height of the pandemic."
133,Science,RUI,"Britain's National Health Service (NHS) has launched a new immunotherapy treatment for cancer patients receiving a certain drug. Previously, the drug had to be administered via IV drip for about 30-40 minutes at a time. Now, the drug can be administered via injection in just 7 minutes, drastically reducing the time that patients take to receive treatment. This development is expected the free up medical staff to care for more patients, and allow for more cancer patients to be treated in each existing facility.
 
 Furthermore, it promises to be cheaper and easier to administer, as it does not require the setting up of an IV line in the patient. Therefore, this reduces the amount of medical consumables required per visit. It is hence also expected to reduce the cost of such treatment for both patients and the healthcare system - a much welcomed piece of news in the midst of rising inflation rates. More research is underway to find out if other drugs and treatments could similarly be adapted."
135,Science,RUI,"The scientific discovery of lab-grown meat had hit the headlines of the news. This advancement in food technology was led by a group of R&D scientists from the University of California. Lab-grown meat is basically the growth of meat from cell of animals in the lab. The cells of animals such as cows and chickens were first extracted. By Simulating the condition for the cells to grow in the lab, cells can multiply and grow outside of the animals. When asked about the texture of the lab-grown meat, the scientists mentioned that the meat tasted 90% close to the real meat. The purpose of lab-grown meat is to reduce the reliance on animals. It can also reduce the environmental consequences of consuming meat."
147,Science,RUI,"America's company Apple developed their first batch of high end technology mobile phones. The mobile phones consists of a large screen which enables user to interact with it like buttons. Users are able to swipe screens and even play games via the screen without a single button. The mobile phone consists of many functions such as texting, playing games, and even reading books and surfing the Internet. This company Apple is very unique and will most likely monopoly or be on the few huge companies surpassing Nokia in the mobile phone industry in the future."
101,Social,FER,"Yishun has always been a bedrock for crazy stunts and stuff getting thrown from high-rise buildings. But this latest incident might just take the cake. An elderly lady of about 60-70 years old can be seen walking around Yishun with just her underwear. She is also holding a broomstick and chasing anyone who happens to be in her vicinity. The video of her has circulated on social media and many Netizens have commented on the incidents. While most comments are about the state of Yishun, some commented about the state of mind of the lady. It is unknown if the police have been involved, but as of now, the lady has not caused any harm to anyone. The family of the elderly lady has refused to comment on the incident when contacted."
109,Social,FER," Singapore - With the critical aging population in Singapore, euthanasia will soon be an option for the elderly who are experiencing chronic illness, loneliness, and isolation. 
 
 This is based on reports of the mental and emotional well-being of Singaporeans aged 80 years old and above. There has been a pressing number of elderly who are facing great difficulties in their daily lives due to a severe illness or mental or emotional disability. Euthanasia services will be available in all private and government hospitals and charges will vary accordingly to the individual's condition. 
 
 Euthanasia has been a controversial topic. This available option will cause more agony and problems where people do not live life to the fullest, reduce productivity, and even cause unnecessary grief to close ones of the person opting for it. Will the younger generation not take living seriously then? How will the Singapore government deal will all these social upheavals? All of this indicates more grave problems to come."
110,Social,FER,"Many BLACKPINK fans were seen at the airport on the 3rd of August in 2023. These fans caused a ruckus in Terminal 1 as they jostled for a good position to catch a glimpse of their favourite artists. The popular girl group was slated to arrive at the airport early in the morning on the 4th of August. However, crowds began to gather as early as 8 a.m. on the 3rd of August. This was to the great annoyance of the many travelers hoping to get from the airport to their next destination. The airport staff were left flustered as to what should be done. In the end, the police were called to disperse the crowds late at night. By 8 p.m. on the 3rd of August, the airport was back to normal."
