Participant number,Topic,internal condition code,news excerpt
104,Economics,FER,"The minimum age for purchasing a house will increase to 40 years old for singles in 2024.
 
 The nation's declining marital and birth rates are causing concern. 
 
 This move is to encourage more people to get married.
 
 Because many people in Singapore are increasingly choosing to become single and unmarried due to rising costs of living.
 
 Being single also allows one to earn and have more savings to accumulate for a flat.
 
 As opposed to an engaged or married couple that will spend major expenses on shopping, entertainment, and travel on most dates. 
 
 Many citizens have since weighed in to disapprove of the action.
 The government will announce more details during the National Day rally speech this year."
133,Economics,FER,"The sudden collapse of DBS Bank has ignited fear in Singaporeans across the island. Many are rushing to withdraw their savings and liquidate other assets as soon as possible, believing that DBS' collapse could have a domino effect on other local banks and foreign banks established here.
 
 
 
 DBS customers have swarmed its headquarters, demanding their money back. This morning, the crowd, in a frenzied peak, smashed their way into the CEO's office and caused nearly $250,000 in damages. People interviewed each told heartbreaking stories of the money they will likely never get back again - the retiree who lost his life savings, the housewife who lost the money she painstakingly saved for her child's university fees, the young couple who was saving up for their first home, the student who worked four jobs to help his family pay their medical bills.
 
 
 
 Investors were not spared either. Shares in DBS Bank, at the time of press, are now worth just SGD $0.026 each - practically worthless compared to its share price of SGD $33.00 just last month. The government is considering bailing out the bank but fears that doing so will rock Singapore's economy even further and cause more civil unrest."
134,Economics,FER,"The Development Bank of Singapore (DBS) recent involvement in the latest Bitcoin crash has sent the nation reeling. ChannelNewsAsia reported a staggering $15 billion dollar loss due to investment in several unreliable bitcoin currencies. This revelation came as a surprise, given that the Monetary Authority of Singapore tightly regulates the financial sector.
 
 The loss has caused shockwaves throughout the financial markets in the region. 
 
  ""I'm very, very disappointed,"" said Mrs Mah. ""To think that all these years I trusted them with my life savings. Now it's all gone."" 
 
 DBS has declined to comment."
146,Economics,FER,"The stock market was hit with yet another round of ""green"" at the closing of today's market. Stock price across the sectors was hit, with technology and entertainment stock-taking the hardest blow, dropping an average of 15% across the board as compared to the open price.
 
An exception was the crypto stock, especially Bitcoin with a surprising growth of 20%, going from the opening price of $1500 to $1850.
 
 Experts say that the stock market's trend will most likely continue until the major players can find a way to stabilized the inflation around the globe."
116,Economics,FEI,"China is going through a major recession right now. Despite opening up post-pandemic, China's economy has been dwindling. This is due to hostile diplomatic relations with Russia. China has even threatened to drop an atomic bomb on Russia. Russia also retaliated by imposing huge sanctions against China. Major trade routes have been cut off. Hence, China is on a downslope economy. It has been a zero-sum game for both countries and further implications for the rest of the world."
117,Economics,FEI,"In Ukraine, the war is still ongoing with Russia. Costs of living have increased as food supply chains are disrupted by the war. Some countries have been quick to offer help in the form of food and ammunition, but there have been reports to suggest that this is not enough. According to online sources such as Reddit, there have been reports of people struggling to find food, and people desperate to leave the country as a result of the war."
124,Economics,FEI,"Bitcoin tumbles below USD $20,000 for the first time in 12 months amidst growing concerns over federal laws regarding its legitimacy and use case. Altcoins such as Ethereum and Solana are met with similar fates as the future of cryptocurrency continues to remain blurry. While the cryptocurrency market has slowly been climbing over the past year, the growth came to a complete halt when the SEC issued statements to clamp down on cryptocurrency, leading to fear. The events that have transpired thus far have led to a liquidation of over USD $10 billion among investors."
125,Economics,FEI,"The ban of eating cows in China has sparked a massive increase in prices of other meats, as a large protein option is now off the menu for many. In fact, several restaurants that specialize in it were forced to close down as their main livelihood or signature dishes were now a crime to serve. Outrage reports have been increasing, with many citizens claiming that the immediate ban has caused widespread hysterics and even caused mass depression amongst those whose livelihoods have been destroyed by this implementation. While the government remains quiet on the next steps for this action, one thing is for sure - no more mooing will be heard in stores for a while."
129,Economics,FEI,"Breaking news! A devastating stock market crash may occur at any time now by leading analysts, worse than any market crash ever before. Keep an eye out for tech stocks in particular, like Apple and Tesla, which are poised to make a nosedive anytime soon. It is highly recommended to pull out any existing stocks and investments before you lose your money and your homes! This is likely due to the market volatility introduced by tech giants such as Elon Musk and Mark Zuckerberg, who have been toying with the economy without a care for everyday folks like you and me. Never before in modern history has the common man been treated like such a commodity. It is high time people like us should make a stand and make our voice heard before it is too late."
135,Economics,FEI,"South Korea's debts had been increasing, which led to a net negative of economic growth during the Covid-19 period. The GDP had also seen a new low for the past 20 years. Prime Minister, Kim Hyun Jin said that the increasing debts South Korea had accumulated was not something that happened overnight. It was mentioned that the Government had been giving out monetary incentives to young and unemployed citizens and small business owners during the Covid-19 period. These incentives were used to help the citizens in need to tide over the difficult times. However, after investigations, it was found that some business owners had been giving untrue ledgers. They declared less income than they supposedly generated, so as to be eligible for the grants. According to investigations, the total amount that was wrongfully given to small business owners was a whooping 1000 billion Korean Won."
136,Economics,FEI,"The trains built in Edinburgh have long been regarded as one of the best in the world. Straight wheel track balance is an essential ride quality characteristic and the unique positioning of latitude in Edinburgh allows it to utilise the Earth's gravity to align construction. Recently, however, China, in its attempt to continue economic development, has started to aggressively attempt to acquire this technology. The need for quality transport systems demands a high standard of rail construction, and unfortunately, China is not close enough to the North Pole. As a result, China has begun to aggressively woo engineers from Edinburgh, offering them sky-high salaries. Chinese competitive companies however claim that this rail quality is just a myth and that local jobs are at stake here. The Scottish so far have offered no comment, except to mention that their pubs are open from 10 in the morning. The British however have been very vocal, saying that the Chinese should take their rail technology instead since they were one of the first to spread it around their colonies."
137,Economics,FEI,"Recently, the government has come up with a new initiative to provide the ageing population with $2000 in cash per month. This is in an effort to ensure that they are able to afford their daily basic necessities. This $2000 will be given to all citizens who are 55 and above. Not only that, they would be given free classes to improve on their technological skills so that they would be able to keep up with up-to-date technologies."
111,Economics,FUR,"In July of 2023, the median inflation rate in Singapore has risen by 1%. This means that the general price level of goods and services in Singapore is now 1% more expensive on average. This is the greatest hike in inflation that has been experienced by the city-state in the past year. Economists consulted by our news agency have highlighted several reasons for this spike in prices. Firstly, the costs of raw materials used to produce goods and services have been rising rapidly across the globe, ultimately impacting our island state in the form of a higher cost burden falling on consumers. Secondly, export bans placed on major exporters have increased both consumer and producer demand for goods from other smaller exporters, hiking up the prices of these goods in general. Thirdly, political factors such as the Russia-Ukraine War have caused global supply shocks which further contribute to the spike in prices of raw materials used to produce goods. Finally, rising labour costs due to tightened immigration policies enforced by the Singapore government have placed pressure on the costs of service provision by businesses. Analysts predict that the rise in inflation should wane in the next 3 months."
126,Economics,FUR,"In Singapore, there are more businesses that undergo mergers and acquisitions to increase productivity and their economies of scale. This is so that they can expand their areas of business. One such instance is the acquisition of Sony by Razer. Sony specialises in mobile phones and electronics, but its brand popularity has been reduced significantly with other competitors in the market. Razer is known for its computers for gaming and gaming accessories. It is with the hope that Razer is able to attract and tap into the talents in electronics from Sony into its expanding company, in particular in the production of its computer parts. Currently, talks and negotiations are underway between the CEOs of both companies to come to a final consensus on the terms and conditions. Once this has been completed which is estimated to be by the end of 2023, an agreement will be signed by both parties."
127,Economics,FUR,"The recent announcement of the Singapore government to reduce goods and service tax has helped many Singaporeans in the middle and lower class to reduce their financial burden. According to a survey conducted by the Monetary Authority of Singapore (MAS), this will help at least 80% of Singaporeans reduce their financial burden on daily essentials. One of the survey respondents, Madam Gan, told Today News that this new policy will definitely reduce the financial burden for their household of four children. In response to the new policy, many retail owners view the policy positively. Retail owners expect to see an increase in sales volume as prices become lower. This will help many small and medium local businesses to recover from the negative effects of Covid in the past two years. The new policy also helps to reduce fear of inflation. The new policy will take effect from 1 September this year."
139,Economics,FUR,"12 September 2023, Singapore - The legalization of the public circulation of cryptocurrency is slated to occur 1 week from now. What does that signify for Singapore's economic practices and more importantly, its economy? It could mean a variety of things. Some expected effects of this are the stronger endorsement of cryptocurrency as a method of payment. Prior to this, cryptocurrency had a growing presence in Singapore which caused communities centered around it to blossom in Singapore. Eugene Ling, co-founder of the Cool Cats NFT Community Singapore, tells us that his interest in cryptocurrency first began through an introduction by a friend. ""I never felt like I could fully trust the banks with my money and that's when I found cryptocurrencies. A monetary asset that wasn't controlled by any government authorities around the world,"" said Eugene."
140,Economics,FUR,"There is a new race in town - Singapore will not only be home to the annual F1 night race spectacle but will also be home to a MotorGP race.
 
 The authorities have announced the race to be held every February for the next 5 years.
 
 The contract was signed between the Singapore Government and MotorGP, and this marks the first time that the latter is holding a street race for its championship.
 
 Many experts predict that while the championship is not as prestigious as F1, it will still bring about huge economic benefits to the country.
 
 The hotel and F&B businesses will see a large boost during the time period, as tourists make their way to the country to watch the event.
 
 MotorGP is also footing most of the bill for Singapore to host the race.
 
 
 
 Many businesses welcome this news and are happy that there is another global event that will drive tourists to visit the country.
 
 
 
 Preparations for the first event in 2024 is already underway."
150,Economics,FUR,"The Singapore Air Force just announced the purchase of the 5th Generation fighter jet F22 from Lockheed Martin. The jet which is the pride of the United States Air Force was until now not available for export due to its highly confidential technology. This announcement is the result of the strengthening of the bilateral relationship between Singapore and the US. Singapore will be the only country allowed to receive the F22, in a highly secret transaction that is estimated to be the largest military spend for Singapore in the past 2 decades. Though the unit cost is undisclosed, it is estimated that each fighter jet will cost around 280MUSD. The British government has expressed some level of disappointment as they have been requesting such agreement for many years and thought they would have been the closest military partner for the USA."
151,Economics,FUR,"The United States has recently announced a potential new policy aimed at foreign property investors along the West Coast. This policy offers a reduced tax rate for foreign buyers and an array of additional incentives according to investment value, with details to come in the following days. This controversial move came about to encourage foreign talent and an influx of funds to ward off the dip in GDP which was seen during the COVID-19 Pandemic.
 
 Commentators and the opposition have found this highly controversial, citing concerns for an increase in hostility toward immigrants and Asian hate crimes, particularly in the state of California. However, Biden pushes forward, assuring the country that multiculturalism and immigration have been the cornerstone on which the country was built and that this policy will pave the path to greater unity in the years ahead."
152,Economics,FUR,"The cost of living has been increasing at an exponential rate in Singapore. 10 years ago, a plate of fried noodles cost $2.50 and today, a plate of fried noodles cost $8. The huge jump in prices has pushed many Singaporeans to consider retirement in our neighbouring country - Malaysia, where the cost of living is lower than in Singapore. The Singapore government has tried to ease Singaporean's worries about the cost of living by giving out vouchers and subsidies, but many still complain that it's not enough."
119,Economics,FUI,"The United States is going through a series of economic measures in order to reduce unemployment to 0%. The country is going to invest heavily in the education sector and offer a greater variety of educational courses to appeal to the wider population. Courses such as digital content creation, video production, software programming, and robotics are going to be in great demand in this increasingly digital economy. Also, softer skills such as negotiation, leadership, and sales will also be taught in public schools. Education will be made compulsory and free for all citizens. Homeschooling is an option for those who have submitted their curriculum online and had it approved. Each student will be provided with basic access to a computer to facilitate online learning."
122,Economics,FUI,"The stock market in China has collapsed. Many investors have lost their life savings overnight. They claim that Kim Jong Un, the leader of North Korea, plotted this scheme. Many domestic and international banks were splattered with paint in Shanghai and Beijing. Multiple riots have occurred in China's major cities such as Shen Zhen and Xia men. 100 people were injured, and 3 lives were lost as a result of these riots. The Chinese communist party (CCP) has urged its citizens to remain calm. Xi Jin Ping, the head of the CCP, assured that he would introduce a series of financial grants to the people."
141,Economics,FUI,"The US dollar has dropped to an all-time low in the recent recession. Economists have attributed the dip to several factors including the rise of other macro-economies such as China. Several foreign exchange investment experts are now considering other currencies for investment. 
 
 Ferraro Juanez, an Economic professor at Yale, noted that other currencies such as the Singapore Dollar (SGD) could possibly be an alternative to the USD due to its relative stability within the last 10 years."
143,Economics,FUI,"The market for crude oil has once again crashed globally, following 2 spikes in all-time high price events. According to the WTI and Brent Crude indexes, the prices of crude oil per barrel dropped from USD $90 to USD $20 early this morning. This is largely due to the sudden declaration that the oil field in the Middle East has found a secondary oil field nearby, and will lead to the higher inventory of crude oil extracted. Another large news was the declaration of an 80% transition of energy sources to greener energy sources in China. With China purchasing 40% of world crude to power the country today, the declaration will mean a sudden gap in demand for crude oil. This sudden increase in supply and decrease in demand shifts the demand-supply curve, which means a sharp decrease in market price. Dealers of crude oil begin panic selling their stocks, pushing down the price even more."
146,Economics,FUI,"Virtual Credit Cards are becoming increasingly popular across the younger generation. They offer a variety of benefits from not being easily lost, to the lack of a card number thus preventing card thieves to the ability to pay as you spend.
 
 Virtual Credit Cards saves the trouble of contacting the banks for loss of cards, as the owner is able to block the card using their phone apps. Furthermore, they offer one-time cards for online shopping to ensure that the chance of credit card thief is kept to the minimum.
 
 Experts comment that this rising trend in virtual cards and other payment methods can be attributed to the recent development in technology and their application in criminal activities."
148,Economics,FUI,"Danish bank Nykredit Bank has been embroiled in a money laundering scandal, sending shockwaves throughout the country well-known for its stringent and well-regulated financial system. Danish police arrested 5 individuals on Sunday, including 3 foreigners from Romania, Russia, and North Macedonia. This scandal has raised questions about Nykredit Bank's adherence to anti-money laundering rules. As of Tuesday, Nykredit Bank's stock price has fallen by 12%, its sharpest drop since the 2007-08 global financial crisis. Other Danish banks also saw their stock prices drop. Denmark's largest bank, Danske Bank, saw its stock price fall by 6%, and Jyske Bank's stock price fell by 8%. Danish authorities are currently investigating the money laundering case at Nykredit. Nykredit Bank declined to comment on the case, citing ongoing investigations by authorities. This money laundering scandal follows the rumoured allegations of Nykredit Bank being involved in Russian banking transactions, which has been outlawed by the EU since Russia's illegal invasion of Ukraine in early 2022."
152,Economics,FUI,"The US has reported that 8 out of 10 Americans are unemployed. The recent spike in unemployment numbers can be attributed to the economic downturn - firms are struggling to keep up with inflation and the lack of demand for their services. Americans, as a result, are turning to other forms of employment such as food delivery. However, the average spending of Americans has decreased greatly due to the economic recession and demand for food delivery services has dropped greatly too. This leaves many Americans stressed in the face of the rising cost of living and the lack of a stable income."
153,Economics,FUI,"Japan's tourism industry has been booming in recent months thanks to the opening of the brand-new Anime Stadium in Shibuya, Tokyo. The Anime Stadium spans the width of five football stadiums. Having been in construction since 2012, the grand opening was met with much anticipation from both locals and international visitors to Japan. Attractions inside the Anime Stadium include exhibits for both mainstream and niche anime shows across a wide range of genres. An ice cream museum and multiple merch shops have also been opened inside. An interactive art installation has also been built in the centre. The Stadium has had over 1 million visitors since its opening 3 months ago. As a result, Japan has seen a large influx of international visitors, and this number is likely to increase in the upcoming holiday season. The Japanese government has made plans to open a second stadium in Kyoto as well, albeit on a smaller scale."
101,Economics,RER,"Ever since the government halted the ""stop at 2"" campaign, the growth of Singapore has for decades depended on the import of foreign expats and laborers. For Singapore to progress economically, we need new blood because Singaporeans, like all other people in developed countries, has a declining birthrate. But is economic progress what Singaporeans truly want today? Our government seems to think so, especially during the 2000-2015 period, where almost anyone can get a PR and most people with some effort can get citizenship. But it does seem like the government has sensed the resentment, the sheer influx of foreigners especially from China has somewhat destabilized the social fabric of Singapore. Even those ethnically Chinese, the Chinese in Singapore are generally ideologically and culturally different. So, the question remains that Singaporeans and the government need to answer. Is the cost of economic growth in Singapore worth it? Are we willing to bear the cost?"
110,Economics,RER,"The Goods and Service Tax has risen from 7% in 2022 to 8% in 2023. When announced by the Monetary Authorities of Singapore late last year, the reaction from the Singapore population was negative and there were murmurs of dissent. The Singapore Government tried to soften the financial blow by handing out cash vouchers to ease the transition into rising costs in 2023. However, these assurance packages did not assure the population at all, who remained disgruntled at the sky-high costs of living in the tiny country. In fact, inflation has caused the price of goods in the country to increase almost fivefold in the last twenty years. A plate of chicken rice that cost 80 cents in 2000 now costs $4."
114,Economics,RER,"Singapore is expected to experience a surge in tourism as we head further and further away from the pandemic.
 In fact, in this coming year, we are expected to see an exponential increase in tourism levels as popular artists such as ""The Weeknd"" and ""Taylor Swift"" choose Singapore as a destination for their world tours.
 This has economic effects on the spending habits of locals too. As they are overwhelmed with excitement to see their famous artists perform live after so many years of lockdown of any fun activities due to the pandemic for the past few years.
 Local fans went through extreme means in order to attempt to purchase tickets. Some go as far as queuing outside of post offices that sell these tickets the day before ticket sales.
 The Singapore government is the happiest around this as the concert alone is expected to make millions in revenue."
115,Economics,RER,"Many Singaporeans are disappointed with the increased exposure of misdeeds by politicians in their country. From affairs to potential corruption, by junior and senior members, sentiments are now mixed as to the trustworthiness of the current government. While press statements have been made by the board, conflicting information has surfaced and has sewn doubt in Singaporeans on what is real or not. Residents, especially those in the older generation, have indicated that they are saddened at the shocking revelation of these misdeeds by their favourite members of parliament, as well as their dismissal. While these issues may seem to dramatise local politics, they may have implications for the larger global view on the stability of Singapore's government and result in economic consequences. The government needs to tread carefully in addressing these issues to ensure that public trust is bolstered and global sentiments are assured."
